,Title,Style Code,Category,Size,Description,Colors,Status,Rating,Picture,Price,Link,Review Dates
506,Nike Air Max Motion 2, AO0266-012,Mens Shoes & Sneakers,"['6', '6.5', '7', '7.5', '8', '8.5', '9', '9.5', '10', '10.5', '11', '11.5', '12', '12.5', '13', '14', '15']","Nodding to Air Max icons like the 270 and 95, the Nike Air Max Motion 2 blends performance comfort with streetwear style. The running-inspired design looks sleek. Breathable mesh and no-sew overlays keep it lightweight. And the low-profile Max Air unit delivers time-tested cushioning.", Black/White,Available,4.4 Stars,"https://static.nike.com/a/images/t_PDP_1280_v1/f_auto,q_auto:eco/i1-bd085116-0890-4321-b635-c76e6db14052/air-max-motion-2-mens-shoe-Ctfkrt.png",$85,https://www.nike.com/t/air-max-motion-2-mens-shoe-Ctfkrt/AO0266-012,"['February 10, 2021', 'February 9, 2021', 'January 28, 2021', 'January 27, 2021', 'January 22, 2021', 'January 6, 2021', 'January 6, 2021', 'January 3, 2021', 'January 3, 2021', 'January 1, 2021', 'December 26, 2020', 'December 25, 2020', 'December 24, 2020', 'December 7, 2020', 'December 7, 2020', 'December 1, 2020', 'November 24, 2020', 'November 17, 2020', 'November 17, 2020', 'November 15, 2020', 'November 8, 2020', 'November 4, 2020', 'November 4, 2020', 'October 31, 2020', 'October 31, 2020', 'October 26, 2020', 'October 26, 2020', 'October 15, 2020', 'October 13, 2020', 'October 9, 2020', 'October 5, 2020', 'September 30, 2020', 'September 28, 2020', 'September 26, 2020', 'September 25, 2020', 'September 23, 2020', 'September 21, 2020', 'September 13, 2020', 'September 13, 2020', 'September 12, 2020', 'September 9, 2020', 'September 9, 2020', 'September 9, 2020', 'September 2, 2020', 'September 2, 2020', 'August 30, 2020', 'August 29, 2020', 'August 26, 2020', 'August 25, 2020', 'August 25, 2020', 'August 25, 2020', 'August 20, 2020', 'August 19, 2020', 'August 15, 2020', 'August 14, 2020', 'August 14, 2020', 'August 11, 2020', 'August 5, 2020', 'August 3, 2020', 'July 29, 2020', 'July 28, 2020', 'July 25, 2020', 'July 25, 2020', 'July 19, 2020', 'July 17, 2020', 'July 15, 2020', 'July 9, 2020', 'July 9, 2020', 'July 7, 2020', 'July 7, 2020', 'June 27, 2020', 'June 24, 2020', 'June 23, 2020', 'June 23, 2020', 'June 21, 2020', 'June 20, 2020', 'June 18, 2020', 'June 14, 2020', 'June 14, 2020', 'June 13, 2020', 'June 13, 2020', 'June 13, 2020', 'June 11, 2020', 'June 11, 2020', 'June 11, 2020', 'June 10, 2020', 'June 2, 2020', 'June 2, 2020', 'June 1, 2020', 'June 1, 2020', 'June 1, 2020', 'May 31, 2020', 'May 27, 2020', 'May 27, 2020', 'May 27, 2020', 'May 25, 2020', 'May 25, 2020', 'May 25, 2020', 'May 22, 2020', 'May 22, 2020', 'May 22, 2020', 'May 21, 2020', 'May 15, 2020', 'May 14, 2020', 'May 11, 2020', 'May 11, 2020', 'May 10, 2020', 'May 10, 2020', 'May 9, 2020', 'May 9, 2020', 'May 8, 2020', 'May 8, 2020', 'May 8, 2020', 'May 7, 2020', 'May 6, 2020', 'May 5, 2020', 'May 4, 2020', 'May 4, 2020', 'May 1, 2020', 'April 30, 2020', 'April 30, 2020', 'April 30, 2020', 'April 29, 2020', 'April 29, 2020', 'April 29, 2020', 'April 26, 2020', 'April 25, 2020', 'April 23, 2020', 'April 23, 2020', 'April 19, 2020', 'April 19, 2020', 'April 18, 2020', 'April 16, 2020', 'April 11, 2020', 'March 15, 2020', 'March 11, 2020', 'March 7, 2020', 'March 5, 2020', 'March 3, 2020', 'March 2, 2020', 'February 24, 2020', 'February 23, 2020', 'February 14, 2020', 'February 14, 2020', 'February 13, 2020', 'February 10, 2020', 'February 4, 2020', 'February 4, 2020', 'January 28, 2020', 'January 28, 2020', 'January 23, 2020', 'January 23, 2020', 'January 23, 2020', 'January 19, 2020', 'January 17, 2020', 'January 15, 2020', 'January 15, 2020', 'January 13, 2020', 'January 13, 2020', 'January 8, 2020', 'January 4, 2020', 'January 3, 2020', 'December 22, 2019', 'December 21, 2019', 'December 14, 2019', 'November 17, 2019', 'November 13, 2019', 'November 8, 2019', 'November 1, 2019', 'October 27, 2019', 'October 27, 2019', 'October 18, 2019', 'October 11, 2019', 'October 4, 2019', 'September 26, 2019', 'September 22, 2019', 'September 14, 2019', 'September 14, 2019', 'September 14, 2019', 'September 9, 2019', 'September 3, 2019', 'August 29, 2019', 'August 28, 2019', 'August 23, 2019', 'August 22, 2019', 'August 22, 2019', 'August 17, 2019', 'August 9, 2019', 'July 15, 2019', 'July 13, 2019', 'July 6, 2019', 'June 30, 2019', 'June 22, 2019', 'June 20, 2019', 'May 14, 2019', 'April 19, 2019']"
507,Nike Alpha Huarache 7 Pro, CJ0265-111,Mens Shoes & Sneakers,[],"Nike’s 1st low-top lacrosse cleat, the Nike Alpha Huarache 7 Pro is lighter and faster than previous versions. The slip-on design has a comfortable fit, and a flexible traction plate lets you move at your top speed on the field.", White/University Red/White,Available,4.2 Stars,"https://static.nike.com/a/images/t_PDP_1280_v1/f_auto,q_auto:eco/9617ca63-8c1d-4fc3-a917-12aceda9f9ab/alpha-huarache-7-pro-lacrosse-cleat-sQKVJW.png",$100,https://www.nike.com/t/alpha-huarache-7-pro-lacrosse-cleat-sQKVJW/CJ0265-111,N/A
508,Nike Offcourt (NFL Dallas Cowboys), DD0519-001,Mens Shoes & Sneakers,"['6', '7', '8', '9', '10', '11', '12', '13', '14', '15', '16']","Cheer your team to victory in comfort with the Nike Offcourt (NFL Dallas Cowboys) Slide. A cushy synthetic leather strap features your team’s logo, while an innovative foam midsole makes this slide so comfy, you’ll never want to take it off.", Black/College Navy/White/Anthracite,Available,0 Stars,"https://static.nike.com/a/images/t_PDP_1280_v1/f_auto,q_auto:eco/91b814ca-2bc9-4d47-a887-d4219cfc121d/offcourt-dallas-cowboys-slide-SCrB1z.png",$35,https://www.nike.com/t/offcourt-dallas-cowboys-slide-SCrB1z/DD0519-001,N/A
509,Nike Triple Jump Elite , 705394-800,Mens Shoes & Sneakers,"['M 3.5 / W 5', 'M 4 / W 5.5', 'M 4.5 / W 6', 'M 5 / W 6.5', 'M 5.5 / W 7', 'M 6 / W 7.5', 'M 6.5 / W 8', 'M 7 / W 8.5', 'M 7.5 / W 9', 'M 8 / W 9.5', 'M 8.5 / W 10', 'M 9 / W 10.5', 'M 9.5 / W 11', 'M 10 / W 11.5', 'M 10.5 / W 12', 'M 11 / W 12.5', 'M 11.5 / W 13', 'M 12 / W 13.5', 'M 12.5 / W 14', 'M 13 / W 14.5', 'M 14 / W 15.5', 'M 15 / W 16.5']",The Nike Triple Jump Elite Unisex Jumping Spike is built with an incredibly light synthetic and TPU upper featuring Nike Flywire technology and adjustable midfoot straps for the lift and support you need when jumping for distance. An outsole Pebax ® plate has six removable spikes for optimal traction during the approach., Bright Mango/Purple Pulse/Light Zitron/Blackened Blue,Available,5 Stars,"https://static.nike.com/a/images/t_PDP_1280_v1/f_auto,q_auto:eco/4064e471-40e0-46fc-bfca-25b34dc88c82/triple-jump-elite-unisex-jumping-spike-NkgqNb.png",$84.97,https://www.nike.com/t/triple-jump-elite-unisex-jumping-spike-NkgqNb/705394-800,"['May 11, 2021', 'November 4, 2020', 'January 12, 2020', 'February 23, 2019']"
510,Nike SB Zoom Stefan Janoski RM, AQ7475-003,Mens Shoes & Sneakers,"['M 4 / W 5.5', 'M 4.5 / W 6', 'M 5 / W 6.5', 'M 5.5 / W 7', 'M 6 / W 7.5', 'M 6.5 / W 8', 'M 7 / W 8.5', 'M 7.5 / W 9', 'M 8 / W 9.5', 'M 8.5 / W 10', 'M 9 / W 10.5', 'M 9.5 / W 11', 'M 10 / W 11.5', 'M 10.5 / W 12', 'M 11 / W 12.5', 'M 11.5 / W 13', 'M 12 / W 13.5', 'M 13 / W 14.5', 'M 14 / W 15.5', 'M 15 / W 16.5', 'M 16 / W 17.5', 'M 17 / W 18.5', 'M 18 / W 19.5']","For more than 10 years, Stefan Janoski's signature shoe has been built ""for daily use."" So when we gave it an update, we made sure it stayed true to that original ethos. The Nike SB Zoom Stefan Janoski RM pairs soft, durable suede with an incredibly flexible, lightweight sole—one that minimizes break-in time so you can maximize skate days.", Black/Black/Gum Light Brown/White,Available,4.1 Stars,"https://static.nike.com/a/images/t_PDP_1280_v1/f_auto,q_auto:eco/hjqejbfh0tkepd5fai04/sb-zoom-stefan-janoski-rm-skate-shoe-fCvbQF.png",$85,https://www.nike.com/t/sb-zoom-stefan-janoski-rm-skate-shoe-fCvbQF/AQ7475-003,"['December 18, 2020', 'December 6, 2020', 'December 5, 2020', 'December 2, 2020', 'November 20, 2020', 'August 26, 2020', 'July 1, 2020', 'June 22, 2020', 'June 11, 2020', 'May 21, 2020', 'April 6, 2020', 'February 29, 2020', 'December 2, 2019', 'June 14, 2019']"
511,Nike React Miler, CW1777-300,Mens Shoes & Sneakers,"['6', '6.5', '7', '7.5', '8', '8.5', '9', '9.5', '10', '10.5', '11', '11.5', '12', '12.5', '13', '14', '15']","The Nike React Miler gives you trusted stability for miles with athlete-informed performance. Made for dependability on your long runs, its intuitive design offers a locked-in fit and a durable feel.", Light Army/Photon Dust/Barely Green/Black,Available,4.5 Stars,"https://static.nike.com/a/images/t_PDP_1280_v1/f_auto,q_auto:eco/67adaa66-fd97-405f-928e-effbee0d0f58/react-miler-mens-running-shoe-DgF6nr.png",$96.97,https://www.nike.com/t/react-miler-mens-running-shoe-DgF6nr/CW1777-300,"['April 20, 2021', 'April 2, 2021', 'March 4, 2021', 'February 28, 2021', 'February 13, 2021', 'January 22, 2021', 'January 22, 2021', 'January 22, 2021', 'January 11, 2021', 'January 8, 2021', 'January 4, 2021', 'December 30, 2020', 'December 29, 2020', 'December 27, 2020', 'December 7, 2020', 'December 6, 2020', 'December 6, 2020', 'December 4, 2020', 'December 2, 2020', 'November 29, 2020', 'November 25, 2020', 'November 22, 2020', 'November 14, 2020', 'November 13, 2020', 'November 11, 2020', 'November 10, 2020', 'November 3, 2020', 'October 25, 2020', 'October 24, 2020', 'October 23, 2020', 'October 21, 2020', 'October 13, 2020', 'October 8, 2020', 'October 3, 2020', 'September 25, 2020', 'September 24, 2020', 'September 24, 2020', 'September 23, 2020', 'September 22, 2020', 'September 21, 2020', 'September 16, 2020', 'September 16, 2020', 'September 16, 2020', 'September 11, 2020', 'September 9, 2020', 'August 12, 2020', 'August 5, 2020', 'August 4, 2020', 'August 4, 2020', 'July 30, 2020', 'July 18, 2020', 'July 18, 2020', 'July 16, 2020', 'July 11, 2020', 'July 3, 2020', 'June 18, 2020', 'June 17, 2020', 'June 11, 2020', 'June 7, 2020', 'June 5, 2020', 'May 20, 2020', 'May 19, 2020', 'May 13, 2020', 'May 2, 2020']"
512,Nike Challenger OG SE, CW7662-002,Mens Shoes & Sneakers,"['3.5', '4', '4.5', '5', '5.5', '6', '6.5', '7', '7.5', '8', '8.5', '9', '9.5', '10', '10.5', '11', '11.5', '12', '12.5', '13', '14', '15']","A near-1-to-1 remake of the original running shoe, the Nike Challenger OG marries soft suedes and stitched overlays. Plush padding around the ankle combines with its sleek, springy midsole to make it the comfy trendsetter.", Iron Grey/White/Black/Iron Grey,Available,4 Stars,"https://static.nike.com/a/images/t_PDP_1280_v1/f_auto,q_auto:eco/7da0a4b0-b60b-43b0-9edf-136ba30fd373/challenger-og-se-mens-shoe-jsfvz0.png",$100,https://www.nike.com/t/challenger-og-se-mens-shoe-jsfvz0/CW7662-002,"['February 12, 2021', 'February 1, 2021', 'December 10, 2020', 'December 7, 2020']"
513,Nike Renew Ride 2 Premium, DA2789-007,Mens Shoes & Sneakers,"['6', '6.5', '7', '7.5', '8', '8.5', '9', '9.5', '10', '10.5', '11', '11.5', '12', '12.5', '13', '14', '15']","Designed for casual runs and all-day wear, the Nike Renew Ride 2 is all about intuitive comfort. New cushioning is even taller for a softer feel. Speckled details add texture to your look.", Iron Grey/High Voltage/Light Smoke Grey/Dark Smoke Grey,Available,5 Stars,"https://static.nike.com/a/images/t_PDP_1280_v1/f_auto,q_auto:eco/3816fa28-8b3d-4db7-96d9-7506f9373924/renew-ride-2-premium-mens-running-shoe-6Qt0hd.png",$75,https://www.nike.com/t/renew-ride-2-premium-mens-running-shoe-6Qt0hd/DA2789-007,"['May 2, 2021']"
514,Nike SB Zoom Blazer Mid, 864349-008,Mens Shoes & Sneakers,[],The Nike SB Zoom Blazer Mid takes a heritage design and tailors it to the needs of the modern skateboarder. Soft cushioning and a flexible sole work together to provide great boardfeel and traction., Photon Dust/Photon Dust/Smoke Grey/Psychic Blue,Available,4.6 Stars,"https://static.nike.com/a/images/t_PDP_1280_v1/f_auto,q_auto:eco/1c3c35ef-4b9e-41f2-901c-9ca8e22ab98b/sb-zoom-blazer-mid-skate-shoe-qX3MZV.png",$85,https://www.nike.com/t/sb-zoom-blazer-mid-skate-shoe-qX3MZV/864349-008,N/A
515,Nike Blazer Mid ’77 Vintage By You, DO7396-991,Mens Shoes & Sneakers,"['M 3.5 / W 5', 'M 4 / W 5.5', 'M 4.5 / W 6', 'M 5 / W 6.5', 'M 5.5 / W 7', 'M 6 / W 7.5', 'M 6.5 / W 8', 'M 7 / W 8.5', 'M 7.5 / W 9', 'M 8 / W 9.5', 'M 8.5 / W 10', 'M 9 / W 10.5', 'M 9.5 / W 11', 'M 10 / W 11.5', 'M 10.5 / W 12', 'M 11 / W 12.5', 'M 11.5 / W 13', 'M 12 / W 13.5', 'M 12.5 / W 14', 'M 13 / W 14.5', 'M 14 / W 15.5', 'M 15 / W 16.5']","The Nike Blazer Mid ’77 Vintage By You gets a heritage makeover with innovative corduroy material that you can cut, rip or let wear naturally to reveal a wavy, tapestry-like fabric underneath with a character all its own. Open mesh, classic leather and luscious suede in 13 colors let you switch up your textures and palette. 3 different Swoosh options, including a wraparound version, let you pick your commitment to heritage vibes or 1-of-a-kind style.", Multi-Color/Multi-Color/Multi-Color/Multi-Color,Customize,N/A,"https://static.nike.com/a/images/t_PDP_1280_v1/f_auto,q_auto:eco/3fcca1aa-d02d-4b28-a9ce-a9ae408ef795/custom-nike-blazer-mid-77-vintage-by-you.png",$120,https://www.nike.com/u/custom-nike-blazer-mid-77-vintage-by-you-10001053/8542522481,N/A
516,Nike Offcourt (NFL Miami Dolphins), DD0520-001,Mens Shoes & Sneakers,"['6', '7', '8', '9', '10', '11', '12', '13', '14', '15', '16', '17', '18']","Cheer your team to victory in comfort with the Nike Offcourt (NFL Miami Dolphins) Slide. A cushy synthetic leather strap features your team’s logo, while an innovative foam midsole makes this slide so comfy, you’ll never want to take it off.", Black/Turbo Green/Brilliant Orange/Anthracite,Available,0 Stars,"https://static.nike.com/a/images/t_PDP_1280_v1/f_auto,q_auto:eco/8bdf0137-d7b7-4fda-971f-27b43cd07a2b/offcourt-miami-dolphins-slide-6zpB3R.png",$35,https://www.nike.com/t/offcourt-miami-dolphins-slide-6zpB3R/DD0520-001,N/A
517,Nike Air Force 1 Low By You, CT7875-994,Mens Shoes & Sneakers,"['4', '4.5', '6', '6.5', '7', '7.5', '8', '8.5', '9', '9.5', '10', '10.5', '11', '11.5', '12', '12.5', '13', '14', '15', '16', '17', '18']","The Nike Air Force 1 Low By You became an instant icon after its debut in 1982. Now you can make this classic your own with a color palette inspired by the ‘80s and ‘90s and premium materials including smooth and rippled leather and a new, matching sidewall selection. It’s time to create a look that speaks to you.", Multi-Color/Multi-Color,Customize,N/A,"https://static.nike.com/a/images/t_PDP_1280_v1/f_auto,q_auto:eco/840bb779-6e55-472b-9333-29bc83891d34/custom-nike-air-force-1-by-you.png",$110,https://www.nike.com/u/custom-nike-air-force-1-by-you-10000830/1020971029,N/A
518,Nike Offcourt (NFL San Francisco 49ers), DD0504-001,Mens Shoes & Sneakers,"['6', '7', '8', '9', '10', '11', '12', '13', '14', '15', '16', '17', '18']","Cheer your team to victory in comfort with the Nike Offcourt (NFL San Francisco 49ers) Slide. A cushy synthetic leather strap features your team’s logo, while an innovative foam midsole makes this slide so comfy, you’ll never want to take it off.", Black/Gym Red/Club Gold/Anthracite,Available,4 Stars,"https://static.nike.com/a/images/t_PDP_1280_v1/f_auto,q_auto:eco/61c7e072-f728-4c72-8c8e-b78c079cdd3e/offcourt-san-francisco-49ers-slide-nVZ7tv.png",$35,https://www.nike.com/t/offcourt-san-francisco-49ers-slide-nVZ7tv/DD0504-001,"['May 14, 2021']"
519,Nike Zoom 400, AA1205-100,Mens Shoes & Sneakers,"['M 4 / W 5.5', 'M 4.5 / W 6', 'M 5 / W 6.5', 'M 5.5 / W 7', 'M 6 / W 7.5', 'M 6.5 / W 8', 'M 7 / W 8.5', 'M 7.5 / W 9', 'M 8 / W 9.5', 'M 8.5 / W 10', 'M 9 / W 10.5', 'M 9.5 / W 11', 'M 10 / W 11.5', 'M 10.5 / W 12', 'M 11 / W 12.5', 'M 11.5 / W 13', 'M 12 / W 13.5', 'M 12.5 / W 14', 'M 13 / W 14.5', 'M 14 / W 15.5', 'M 15 / W 16.5']",The Nike Zoom 400 is designed for sprinting events. It features an ultrathin design with a lightweight spike plate so you can fly past the competition., White/Black/Hyper Jade/Flash Crimson,Available,0 Stars,"https://static.nike.com/a/images/t_PDP_1280_v1/f_auto,q_auto:eco/f385e9f2-68ad-4ee9-acf7-296800130cdf/zoom-400-racing-spike-g6Ppz6.png",$110,https://www.nike.com/t/zoom-400-racing-spike-g6Ppz6/AA1205-100,N/A
520,Nike React Element 55, BQ6166-008,Mens Shoes & Sneakers,"['5.5', '6', '6.5', '7', '7.5', '8', '8.5', '9', '9.5', '10', '10.5', '11', '11.5', '12', '12.5', '13', '14', '15']",The Nike React Element 55 Shoe borrows design lines from heritage runners like the Nike Internationalist and then places it all on Nike React technology., Black/Dark Grey,Available,4.2 Stars,"https://static.nike.com/a/images/t_PDP_1280_v1/f_auto,q_auto:eco/cwblyah42iinky00xmyg/react-element-55-mens-shoe-68CDfV.png",$103.97,https://www.nike.com/t/react-element-55-mens-shoe-68CDfV/BQ6166-008,"['January 22, 2021', 'December 2, 2020', 'November 22, 2020', 'October 13, 2020', 'September 29, 2020', 'August 18, 2020', 'August 13, 2020', 'August 3, 2020', 'June 25, 2020', 'May 23, 2020', 'May 22, 2020', 'May 20, 2020', 'May 16, 2020', 'May 15, 2020', 'May 14, 2020', 'May 9, 2020', 'April 28, 2020', 'April 21, 2020', 'April 15, 2020', 'April 15, 2020', 'April 13, 2020', 'April 12, 2020', 'April 7, 2020', 'March 24, 2020', 'February 25, 2020', 'February 25, 2020', 'February 22, 2020', 'February 13, 2020', 'February 8, 2020', 'February 4, 2020', 'January 28, 2020', 'January 22, 2020', 'January 21, 2020', 'January 17, 2020', 'January 16, 2020', 'December 24, 2019', 'December 22, 2019', 'December 18, 2019', 'December 13, 2019', 'December 9, 2019', 'November 30, 2019', 'November 20, 2019', 'November 12, 2019', 'November 5, 2019', 'October 25, 2019', 'October 25, 2019', 'October 9, 2019', 'October 9, 2019', 'October 6, 2019', 'October 2, 2019', 'October 2, 2019', 'September 28, 2019', 'September 24, 2019', 'September 12, 2019', 'September 11, 2019', 'August 31, 2019', 'August 29, 2019', 'August 28, 2019', 'August 17, 2019', 'August 5, 2019', 'August 1, 2019', 'July 29, 2019', 'July 28, 2019', 'July 25, 2019', 'July 8, 2019', 'July 3, 2019', 'July 3, 2019', 'June 30, 2019', 'June 14, 2019', 'June 14, 2019', 'June 12, 2019', 'June 7, 2019', 'June 4, 2019', 'June 1, 2019', 'June 1, 2019', 'May 30, 2019', 'May 22, 2019', 'May 20, 2019', 'May 19, 2019', 'May 12, 2019', 'May 12, 2019', 'April 25, 2019', 'April 10, 2019', 'April 10, 2019', 'April 2, 2019', 'March 15, 2019', 'March 15, 2019', 'March 3, 2019', 'March 1, 2019', 'February 26, 2019', 'February 25, 2019', 'February 14, 2019', 'February 12, 2019', 'February 12, 2019', 'January 23, 2019', 'January 18, 2019', 'December 29, 2018', 'November 26, 2018', 'November 23, 2018', 'October 25, 2018']"
521,Nike Tiempo Legend 8 Club MG, AT6107-090,Mens Shoes & Sneakers,"['M 4 / W 5.5', 'M 4.5 / W 6', 'M 5 / W 6.5', 'M 5.5 / W 7', 'M 6 / W 7.5', 'M 6.5 / W 8', 'M 7 / W 8.5', 'M 7.5 / W 9', 'M 8 / W 9.5', 'M 8.5 / W 10', 'M 9 / W 10.5', 'M 9.5 / W 11', 'M 10 / W 11.5', 'M 10.5 / W 12', 'M 11 / W 12.5', 'M 11.5 / W 13', 'M 12 / W 13.5', 'M 12.5 / W 14', 'M 13 / W 14.5', 'M 14 / W 15.5', 'M 15 / W 16.5']",The Nike Tiempo Legend 8 Club MG takes the touch of textured synthetic leather and adds a versatile multi-ground plate for traction on natural- and artificial-grass surfaces., Black/Light Photo Blue/Cyber/Black,Available,4.3 Stars,"https://static.nike.com/a/images/t_PDP_1280_v1/f_auto,q_auto:eco/cd239a11-d306-4c61-b396-af0324e3254f/tiempo-legend-8-club-mg-multi-ground-soccer-cleat-tdcZGL.png",$45,https://www.nike.com/t/tiempo-legend-8-club-mg-multi-ground-soccer-cleat-tdcZGL/AT6107-090,"['March 1, 2021', 'February 8, 2021', 'September 29, 2020', 'September 25, 2020', 'September 22, 2020', 'September 22, 2020', 'September 21, 2020', 'September 19, 2020', 'September 16, 2020', 'September 7, 2020', 'August 20, 2020', 'July 28, 2020', 'July 1, 2020', 'June 20, 2020', 'June 12, 2020', 'March 28, 2020', 'March 19, 2020', 'March 8, 2020', 'March 2, 2020', 'February 26, 2020', 'February 20, 2020', 'February 12, 2020', 'November 20, 2019', 'November 14, 2019', 'November 12, 2019', 'October 30, 2019', 'October 29, 2019', 'October 24, 2019', 'September 17, 2019', 'September 11, 2019', 'September 11, 2019', 'September 10, 2019', 'September 10, 2019', 'August 31, 2019', 'August 28, 2019', 'August 14, 2019']"
522,Nike Air Max 95 SE, CU1560-001,Mens Shoes & Sneakers,"['6', '6.5', '7', '7.5', '8', '8.5', '9', '9.5', '10', '10.5', '11', '11.5', '12', '12.5', '13', '14', '15']","Taking inspiration from the human body and running DNA, the Nike Air Max 95 SE mixes unbelievable comfort with head turning style. The iconic side panels represent muscles while visible Nike Air in the heel and forefoot cushions your every step.", Enigma Stone/White/Iron Grey/Off Noir,Member Access,4.7 Stars,"https://static.nike.com/a/images/t_PDP_1280_v1/f_auto,q_auto:eco/809da5ed-a8d0-4066-a12f-d56f2c98703d/air-max-95-se-mens-shoe-264Jht.png",$170,https://www.nike.com/t/air-max-95-se-mens-shoe-264Jht/CU1560-001,"['January 27, 2021', 'January 26, 2021', 'January 19, 2021', 'January 13, 2021', 'November 22, 2020', 'November 16, 2020']"
523,Nike Zoom Rival D 10, 907566-800,Mens Shoes & Sneakers,"['M 1 / W 2.5', 'M 1.5 / W 3', 'M 2 / W 3.5', 'M 2.5 / W 4', 'M 3 / W 4.5', 'M 3.5 / W 5', 'M 4 / W 5.5', 'M 4.5 / W 6', 'M 5 / W 6.5', 'M 5.5 / W 7', 'M 6 / W 7.5', 'M 6.5 / W 8', 'M 7 / W 8.5', 'M 7.5 / W 9', 'M 8 / W 9.5', 'M 8.5 / W 10', 'M 9 / W 10.5', 'M 9.5 / W 11', 'M 10 / W 11.5', 'M 10.5 / W 12', 'M 11 / W 12.5', 'M 11.5 / W 13', 'M 12 / W 13.5', 'M 12.5 / W 14', 'M 13 / W 14.5', 'M 14 / W 15.5', 'M 15 / W 16.5']","The Nike Zoom Rival D 10 Unisex Track Spike is designed to run short and long distances, made with single-layer mesh and Phylon cushioning for breathable comfort from start to finish. Five removable spikes offer custom traction, and a Pebax ® plate provides stability with minimal bulk.", Bright Mango/Purple Pulse/White/Blackened Blue,Available,4.2 Stars,"https://static.nike.com/a/images/t_PDP_1280_v1/f_auto,q_auto:eco/eb0e49ac-5496-4990-ae6e-974c03ca1859/zoom-rival-d-10-unisex-track-spike-V32GbO.png",$65,https://www.nike.com/t/zoom-rival-d-10-unisex-track-spike-V32GbO/907566-800,"['August 14, 2020', 'March 19, 2020', 'March 13, 2020', 'March 13, 2020', 'February 19, 2020', 'May 24, 2019', 'May 2, 2019', 'March 14, 2019', 'January 17, 2019']"
524,Nike Metcon 6 AMP, CZ0602-434,Mens Shoes & Sneakers,"['M 3.5 / W 5', 'M 4 / W 5.5', 'M 4.5 / W 6', 'M 5 / W 6.5', 'M 5.5 / W 7', 'M 6 / W 7.5', 'M 6.5 / W 8', 'M 7 / W 8.5', 'M 7.5 / W 9', 'M 8 / W 9.5', 'M 8.5 / W 10', 'M 9 / W 10.5', 'M 9.5 / W 11', 'M 10 / W 11.5', 'M 10.5 / W 12', 'M 11 / W 12.5', 'M 11.5 / W 13', 'M 12 / W 13.5', 'M 12.5 / W 14', 'M 13 / W 14.5', 'M 14 / W 15.5', 'M 15 / W 16.5']","The Nike Metcon 6 AMP helps keep your foot cool when you're going full steam. It stands up to the push and pull of heavily weighted and high-intensity workouts, delivering stability and durability. The paisley pattern takes design cues from luggage in honor of your next competition or qualifying event away from home.", Deep Royal Blue/Lagoon Pulse/Electric Green,Just In,0 Stars,"https://static.nike.com/a/images/t_PDP_1280_v1/f_auto,q_auto:eco/5e951897-bdf5-41d7-bd3d-87abbdf47281/metcon-6-amp-training-shoe-scSz5d.png",$140,https://www.nike.com/t/metcon-6-amp-training-shoe-scSz5d/CZ0602-434,N/A
525,Nike Offcourt (NFL Seattle Seahawks), DD0545-001,Mens Shoes & Sneakers,"['6', '7', '8', '9', '10', '11', '12', '13', '14', '15', '16', '17', '18']","Cheer your team to victory in comfort with the Nike Offcourt (NFL Seattle Seahawks) Slide. A cushy synthetic leather strap features your team’s logo, while an innovative foam midsole makes this slide so comfy, you’ll never want to take it off.", Black/Action Green/College Navy/Anthracite,Available,0 Stars,"https://static.nike.com/a/images/t_PDP_1280_v1/f_auto,q_auto:eco/0611bb99-defe-4f2f-ae28-30bfc441ee50/offcourt-seattle-seahawks-slide-hXmGGW.png",$35,https://www.nike.com/t/offcourt-seattle-seahawks-slide-hXmGGW/DD0545-001,N/A
