,Title,Style Code,Category,Size,Description,Colors,Status,Rating,Picture,Price,Link,Review Dates
140,Nike DBreak-Type, CJ1156-003,Mens Shoes & Sneakers,"['4', '4.5', '5', '5.5', '6', '6.5', '7', '7.5', '8', '8.5', '9', '9.5', '10', '10.5', '11', '11.5', '12', '12.5', '13', '14', '15']","Deconstruct the past and step into the present with the Nike DBreak-Type. The airy mesh upper and exaggerated stitching add a bold, fresh look onto early Bowerman prototypes pulled from the archives. Retro suede and heel clips designed for support keep you connected to history while the rubber Waffle outsole features flashy angling at the back for a modern look.", Black/White,Available,4.7 Stars,"https://static.nike.com/a/images/t_PDP_1280_v1/f_auto,q_auto:eco/77097500-10a2-4948-9caa-b2356a5331af/dbreak-type-mens-shoe-CxCBss.png",$90,https://www.nike.com/t/dbreak-type-mens-shoe-CxCBss/CJ1156-003,"['March 19, 2021', 'March 15, 2021', 'March 8, 2021', 'March 7, 2021', 'February 16, 2021', 'February 15, 2021', 'February 4, 2021', 'February 1, 2021', 'January 30, 2021', 'January 24, 2021', 'January 22, 2021', 'January 19, 2021', 'January 17, 2021', 'January 10, 2021', 'January 9, 2021', 'January 5, 2021', 'December 31, 2020', 'December 29, 2020', 'December 22, 2020', 'December 16, 2020', 'December 7, 2020', 'November 28, 2020', 'November 13, 2020', 'October 28, 2020', 'October 27, 2020', 'October 25, 2020', 'October 5, 2020', 'September 5, 2020', 'August 30, 2020', 'August 26, 2020', 'August 18, 2020', 'August 10, 2020', 'August 10, 2020', 'August 8, 2020', 'August 7, 2020', 'July 26, 2020', 'July 23, 2020', 'July 22, 2020', 'July 22, 2020', 'July 19, 2020', 'July 19, 2020', 'July 14, 2020', 'July 14, 2020', 'July 8, 2020', 'July 8, 2020', 'June 11, 2020', 'June 11, 2020', 'June 9, 2020', 'June 6, 2020', 'June 1, 2020', 'May 29, 2020', 'May 28, 2020', 'May 22, 2020', 'May 21, 2020', 'May 20, 2020', 'May 19, 2020', 'May 18, 2020', 'May 16, 2020', 'May 15, 2020', 'May 14, 2020', 'May 14, 2020', 'May 7, 2020']"
141,Nike Air Max 96 II, CZ1921-100,Mens Shoes & Sneakers,"['M 3.5 / W 5', 'M 4 / W 5.5', 'M 4.5 / W 6', 'M 5 / W 6.5', 'M 5.5 / W 7', 'M 6 / W 7.5', 'M 6.5 / W 8', 'M 7 / W 8.5', 'M 7.5 / W 9', 'M 8 / W 9.5', 'M 8.5 / W 10', 'M 9 / W 10.5', 'M 9.5 / W 11', 'M 10 / W 11.5', 'M 10.5 / W 12', 'M 11 / W 12.5', 'M 11.5 / W 13', 'M 12 / W 13.5', 'M 12.5 / W 14', 'M 13 / W 14.5', 'M 14 / W 15.5', 'M 15 / W 16.5']","For the first time, the Air Max 96 II returns with a 1-1 remake. Bringing back the sporty aesthetic imagined by famed Nike designer Sergio Lorenzo with retro colors on classic '90s construction, it's a return to throwback track styling. Nike Air cushioning keeps it comfortable. Long live the bubble.", White/Midnight Navy/University Gold/Black,Available,0 Stars,"https://static.nike.com/a/images/t_PDP_1280_v1/f_auto,q_auto:eco/865dc084-8d54-47f5-91b2-e3447087787c/air-max-96-ii-mens-shoe-0C8Dm8.png",$160,https://www.nike.com/t/air-max-96-ii-mens-shoe-0C8Dm8/CZ1921-100,N/A
142,Nike Air Zoom Infinity Tour, CT0540-177,Mens Shoes & Sneakers,[],"Revolutionize your game. Inspired by a running shoe, the Nike Air Zoom Infinity Tour delivers unrivaled comfort and response. Thanks to a new, innovative traction pattern, you'll get the grip you need to maximize the power of your swing.", White/Hot Punch/Light Bone/Aurora Green,Available,4.2 Stars,"https://static.nike.com/a/images/t_PDP_1280_v1/f_auto,q_auto:eco/0070fd23-62af-4c05-9d3b-15062aa1b57c/air-zoom-infinity-tour-golf-shoe-d6B7Jt.png",$160,https://www.nike.com/t/air-zoom-infinity-tour-golf-shoe-d6B7Jt/CT0540-177,N/A
143,Nike Offcourt (NFL Arizona Cardinals), DD0514-001,Mens Shoes & Sneakers,"['6', '7', '8', '9', '10', '11', '12', '13', '14', '15', '16', '17', '18']","Cheer your team to victory in comfort with the Nike Offcourt (NFL Arizona Cardinals) Slide. A cushy synthetic leather strap features your team’s logo, while an innovative foam midsole makes this slide so comfy, you’ll never want to take it off.", Black/Tough Red/White/Anthracite,Available,0 Stars,"https://static.nike.com/a/images/t_PDP_1280_v1/f_auto,q_auto:eco/90df93aa-6f46-4412-9b54-9efafec65faa/offcourt-arizona-cardinals-slide-MmWZ1t.png",$35,https://www.nike.com/t/offcourt-arizona-cardinals-slide-MmWZ1t/DD0514-001,N/A
144,Nike Alpha Huarache Elite 3 Mid, CV3550-101,Mens Shoes & Sneakers,"['7', '7.5', '8', '8.5', '9', '9.5', '10', '10.5', '11', '11.5', '12', '12.5', '13', '13.5', '14', '15', '16']","Dominate any position on the field in the Nike Alpha Huarache Elite 3 Mid, with its sneaker-like feel and versatile performance. Soft and responsive Nike React foam gives you a smooth ride and helps minimize stud pressure underfoot. A lightweight and breathable upper with an ankle strap locks you in with the support you need without adding extra bulk.", White/Iron Grey/Electric Green/Light Smoke Grey,Available,2.5 Stars,"https://static.nike.com/a/images/t_PDP_1280_v1/f_auto,q_auto:eco/ff1be9eb-7438-40e9-8ba6-4d77293a95f4/alpha-huarache-elite-3-mid-mens-baseball-cleat-K1Jsp2.png",$95,https://www.nike.com/t/alpha-huarache-elite-3-mid-mens-baseball-cleat-K1Jsp2/CV3550-101,"['April 17, 2021', 'December 7, 2020']"
145,Nike Phantom GT Elite Dynamic Fit 3D FG, CZ3458-467,Mens Shoes & Sneakers,"['M 4 / W 5.5', 'M 4.5 / W 6', 'M 5 / W 6.5', 'M 5.5 / W 7', 'M 6 / W 7.5', 'M 6.5 / W 8', 'M 7 / W 8.5', 'M 7.5 / W 9', 'M 8 / W 9.5', 'M 8.5 / W 10', 'M 9 / W 10.5', 'M 9.5 / W 11', 'M 10 / W 11.5', 'M 10.5 / W 12', 'M 11 / W 12.5', 'M 11.5 / W 13', 'M 12 / W 13.5', 'M 12.5 / W 14', 'M 13 / W 14.5']","Phantom players are multifaceted; they’re calculated, instinctive and have a provocative style of play. The Nike Phantom GT Elite Dynamic Fit 3D FG encapsulates these characteristics with a repeating Swoosh logo and a 3D-inspired overlay that represents the 3 sides to every Phantom player.", Chlorine Blue/Opti Yellow/White/Pink Blast,Just In,0 Stars,"https://static.nike.com/a/images/t_PDP_1280_v1/f_auto,q_auto:eco/f678a5c4-8454-4d74-aed8-c8484fce2839/phantom-gt-elite-dynamic-fit-3d-fg-firm-ground-soccer-cleat-SBzbds.png",$275,https://www.nike.com/t/phantom-gt-elite-dynamic-fit-3d-fg-firm-ground-soccer-cleat-SBzbds/CZ3458-467,N/A
146,"Nike SFB Field 2 8"" GORE-TEX®", AQ1199-001,Mens Shoes & Sneakers,"['6', '6.5', '7', '7.5', '8', '8.5', '9', '9.5', '10', '10.5', '11', '11.5', '12', '12.5', '13', '14', '15']","Made with waterproof fabric and durable leather, the Nike SFB Field 2 8"" GORE-TEX® is a lightweight yet high-performance boot designed to support heavier loads in all theaters. The sole is equipped with an aggressive tread pattern that provides exceptional traction over challenging terrain, while an internal rock shield helps prevent punctures.", Black/Black,Available,4.8 Stars,"https://static.nike.com/a/images/t_PDP_1280_v1/f_auto,q_auto:eco/13554aa0-f411-4c7e-8cc1-3aa855eb74f3/sfb-field-2-8-gore-tex-tactical-boot-hk7SJs.png",$190,https://www.nike.com/t/sfb-field-2-8-gore-tex-tactical-boot-hk7SJs/AQ1199-001,"['April 29, 2021', 'October 29, 2020', 'June 12, 2020', 'January 13, 2020']"
147,Nike Tiempo Legend 8 Pro FG, AT6133-060,Mens Shoes & Sneakers,"['M 4 / W 5.5', 'M 4.5 / W 6', 'M 5 / W 6.5', 'M 5.5 / W 7', 'M 6 / W 7.5', 'M 6.5 / W 8', 'M 7 / W 8.5', 'M 7.5 / W 9', 'M 8 / W 9.5', 'M 8.5 / W 10', 'M 9 / W 10.5', 'M 9.5 / W 11', 'M 10 / W 11.5', 'M 10.5 / W 12', 'M 11 / W 12.5', 'M 11.5 / W 13', 'M 12 / W 13.5', 'M 12.5 / W 14', 'M 13 / W 14.5', 'M 14 / W 15.5', 'M 15 / W 16.5']","The Nike Tiempo Legend 8 Pro FG has soft, premium calfskin leather for a legendary touch. A plush lining in the heel hugs your foot, while the sides of the tongue stretch to make it easy to put on your cleats.", Black/Chile Red/Dark Smoke Grey,Available,4.3 Stars,"https://static.nike.com/a/images/t_PDP_1280_v1/f_auto,q_auto:eco/6a2d4cf1-5ecb-4ebe-bacf-2f1aac05e8f3/tiempo-legend-8-pro-fg-firm-ground-soccer-cleat-xn2l5X.png",$98.97,https://www.nike.com/t/tiempo-legend-8-pro-fg-firm-ground-soccer-cleat-xn2l5X/AT6133-060,"['March 4, 2021', 'March 1, 2021', 'February 9, 2021', 'January 27, 2021', 'November 22, 2020', 'November 15, 2020', 'October 26, 2020', 'October 14, 2020', 'October 1, 2020', 'September 22, 2020', 'August 31, 2020', 'August 18, 2020', 'August 18, 2020', 'July 26, 2020', 'July 26, 2020', 'May 29, 2020', 'May 14, 2020', 'May 14, 2020', 'April 25, 2020', 'April 20, 2020', 'April 15, 2020', 'February 29, 2020', 'February 23, 2020', 'February 14, 2020', 'January 28, 2020', 'January 18, 2020', 'January 14, 2020', 'November 28, 2019', 'November 17, 2019', 'November 13, 2019', 'October 25, 2019', 'October 21, 2019', 'October 17, 2019', 'September 12, 2019', 'September 8, 2019', 'September 7, 2019', 'September 5, 2019', 'September 4, 2019']"
148,Nike Alpha Huarache Elite 3 Low By You, DA0662-991,Mens Shoes & Sneakers,"['7', '7.5', '8', '8.5', '9', '9.5', '10', '10.5', '11', '11.5', '12', '12.5', '13', '13.5', '14', '15', '16']","The Nike Alpha Huarache Elite 3 Low By You gets a major upgrade with React foam cushioning and a plusher insole for ultra-responsive comfort without extra weight. A new translucent snakeskin graphic and patent leather options create an everyday aesthetic that might make you want an off-field version. Make it your own with an MLB-inspired color palette, chrome accents and new personalization options.", Multi-Color/Multi-Color,Customize,N/A,"https://static.nike.com/a/images/t_PDP_1280_v1/f_auto,q_auto:eco/3eb440be-0cc1-4bc7-bef1-72071ef4a03c/custom-nike-alpha-huarache-elite-3-low-by-you.png",$110,https://www.nike.com/u/custom-nike-alpha-huarache-elite-3-low-by-you-10001002/9014184934,N/A
149,Nike Court Legacy, DJ1971-001,Mens Shoes & Sneakers,"['6', '6.5', '7', '7.5', '8', '8.5', '9', '9.5', '10', '10.5', '11', '11.5', '12', '12.5', '13', '14', '15']","Honoring its history rooted in tennis culture, the Nike Court Legacy Slip-On reinvents a classic with its easy-to-wear design. Crafted from durable canvas and featuring heritage details like the Swoosh license plate on the back, the style lets you bridge sport and fashion.", Black/Black/Black,Just In,0 Stars,"https://static.nike.com/a/images/t_PDP_1280_v1/f_auto,q_auto:eco/613d1d53-30ad-4910-9d66-6ba76c7982f6/court-legacy-mens-slip-on-SJssls.png",$55,https://www.nike.com/t/court-legacy-mens-slip-on-SJssls/DJ1971-001,N/A
150,Nike Offcourt (NFL Minnesota Vikings), DD0554-001,Mens Shoes & Sneakers,"['6', '7', '8', '9', '10', '11', '12', '13', '14', '15', '16', '17', '18']","Cheer your team to victory in comfort with the Nike Offcourt (NFL Minnesota Vikings) Slide. A cushy synthetic leather strap features your team’s logo, while an innovative foam midsole makes this slide so comfy, you’ll never want to take it off.", Black/Court Purple/University Gold/Anthracite,Available,0 Stars,"https://static.nike.com/a/images/t_PDP_1280_v1/f_auto,q_auto:eco/4fc2f150-98ee-4ba1-9b12-b8ad14e497b8/offcourt-minnesota-vikings-slide-Wj38Tc.png",$35,https://www.nike.com/t/offcourt-minnesota-vikings-slide-Wj38Tc/DD0554-001,N/A
151,Nike Court Legacy, CU4150-104,Mens Shoes & Sneakers,[],"Honoring a history in tennis culture, the Nike Court Legacy blends classic style with a modern, street-worthy design. Crisp leather and intricate needlework add to your courtside vibe.", White/Gum Light Brown/Cerulean,Available,4.5 Stars,"https://static.nike.com/a/images/t_PDP_1280_v1/f_auto,q_auto:eco/a7f1c1c2-800e-481f-b3dc-589842f6404c/court-legacy-mens-shoe-Lswv5z.png",$60,https://www.nike.com/t/court-legacy-mens-shoe-Lswv5z/CU4150-104,N/A
152,Nike Zoom Rize 2 By You, DA9292-991,Mens Shoes & Sneakers,"['M 7 / W 8.5', 'M 7.5 / W 9', 'M 8 / W 9.5', 'M 8.5 / W 10', 'M 9 / W 10.5', 'M 9.5 / W 11', 'M 10 / W 11.5', 'M 10.5 / W 12', 'M 11 / W 12.5', 'M 11.5 / W 13', 'M 12 / W 13.5', 'M 12.5 / W 14', 'M 13 / W 14.5', 'M 13.5 / W 15', 'M 14 / W 15.5', 'M 15 / W 16.5']","It's finally here: The Nike Zoom Rize 2 By You is a customizable shoe that's brimming with team spirit. Make your mark with colors and details that match your team's energy, like a haptic print upper, tonal options, and iridescent detailing. Responsive cushioning and extra-durable materials help you outlast your opponents all season long.", Multi-Color/Multi-Color/Multi-Color,Customize,N/A,"https://static.nike.com/a/images/t_PDP_1280_v1/f_auto,q_auto:eco/d673dff6-0d68-4267-a0e2-953563053057/custom-nike-zoom-rize-2-by-you.png",$160,https://www.nike.com/u/custom-nike-zoom-rize-2-by-you-10000975/3877872214,N/A
153,Nike Air Force 1, DA0418-001,Mens Shoes & Sneakers,"['6', '6.5', '7', '7.5', '8', '8.5', '9', '9.5', '10', '10.5', '11', '11.5', '12', '12.5', '13', '14', '15', '16', '17', '18']","With an iconic design, the Nike Air Force 1 Boot bridges indoor hoops style with the rugged outdoors. The large lugs on the rubber outsole add durable traction while the removable silicone ankle strap lets you personalize your style. The padded, high-cut collar adds heritage court comfort and features a tough webbing pull strap for a finishing touch.", Black/Anthracite/Black,Available,5 Stars,"https://static.nike.com/a/images/t_PDP_1280_v1/f_auto,q_auto:eco/4738528b-070a-419e-81ce-2bee0ea6c4f7/air-force-1-mens-boot-rDmRsD.png",$130.97,https://www.nike.com/t/air-force-1-mens-boot-rDmRsD/DA0418-001,[]
154,Nike Free RN 2018, 942836-002,Mens Shoes & Sneakers,"['6', '6.5', '7', '7.5', '8', '8.5', '9', '9.5', '10', '10.5', '11', '11.5', '12', '12.5', '13', '14', '15']","Made for short runs, from your daily 5K to that spontaneous sprint, the Nike Free RN 2018 Men's Running Shoe is as flexible as ever. The innovative sole has an updated design, yet still delivers a comfortable, barefoot-like feel. Easily worn with your everyday outfit, or packed in a tote or backpack for a quick change, these are the most versatile in the Free RN family. So you can be up for anything.", Black/Anthracite,Available,4.7 Stars,"https://static.nike.com/a/images/t_PDP_1280_v1/f_auto,q_auto:eco/ma16mujojp0ir0us0qu6/free-rn-2018-mens-running-shoe-4VTnGqeZ.png",$64.97,https://www.nike.com/t/free-rn-2018-mens-running-shoe-4VTnGqeZ/942836-002,[]
155,Nike Air Zoom-Type By You, DA7562-991,Mens Shoes & Sneakers,"['6', '6.5', '7', '7.5', '8', '8.5', '9', '9.5', '10', '10.5', '11', '11.5', '12', '12.5', '13', '14', '15']","The Nike Air Zoom-Type By You celebrates Nike innovation with your own personal twist. Its stacked foam heel and recycled knit upper mix conscience with comfort. Featuring the same tech worn by athletes underfoot, extra padding around the ankle and accents of decorative stitching, it's made to showcase your dreams.", Multi-Color/Multi-Color/Multi-Color,Customize,N/A,"https://static.nike.com/a/images/t_PDP_1280_v1/f_auto,q_auto:eco/b1a6ed39-aaeb-4864-9347-88ddefa53a53/custom-air-zoom-type-by-you.png",$170,https://www.nike.com/u/custom-air-zoom-type-by-you-10000941/7635940411,N/A
156,Nike Offcourt (NFL Philadelphia Eagles), DD0523-001,Mens Shoes & Sneakers,"['6', '7', '8', '9', '10', '11', '12', '13', '14', '15', '16', '17', '18']","Cheer your team to victory in comfort with the Nike Offcourt (NFL Philadelphia Eagles) Slide. A cushy synthetic leather strap features your team’s logo, while an innovative foam midsole makes this slide so comfy, you’ll never want to take it off.", Black/Sport Teal/White/Anthracite,Available,0 Stars,"https://static.nike.com/a/images/t_PDP_1280_v1/f_auto,q_auto:eco/0e7c7d43-40d4-4568-bf60-bd7eb15abf89/offcourt-philadelphia-eagles-slide-h9RDWb.png",$35,https://www.nike.com/t/offcourt-philadelphia-eagles-slide-h9RDWb/DD0523-001,N/A
157,Nike Tiempo Legend 8 Pro TF, AT6136-090,Mens Shoes & Sneakers,"['M 4 / W 5.5', 'M 4.5 / W 6', 'M 5 / W 6.5', 'M 5.5 / W 7', 'M 6 / W 7.5', 'M 6.5 / W 8', 'M 7 / W 8.5', 'M 7.5 / W 9', 'M 8 / W 9.5', 'M 8.5 / W 10', 'M 9 / W 10.5', 'M 9.5 / W 11', 'M 10 / W 11.5', 'M 10.5 / W 12', 'M 11 / W 12.5', 'M 11.5 / W 13', 'M 12 / W 13.5', 'M 12.5 / W 14', 'M 13 / W 14.5', 'M 14 / W 15.5', 'M 15 / W 16.5']",The Nike Tiempo Legend 8 Pro TF takes the touch of textured leather and adds a grippy rubber outsole for multidirectional traction., Black/Siren Red/Light Photo Blue/Black,Available,3.3 Stars,"https://static.nike.com/a/images/t_PDP_1280_v1/f_auto,q_auto:eco/3d73fd80-977d-44d0-9691-830eda3e5f86/tiempo-legend-8-pro-tf-artificial-turf-soccer-shoe-qqBgGv.png",$100.97,https://www.nike.com/t/tiempo-legend-8-pro-tf-artificial-turf-soccer-shoe-qqBgGv/AT6136-090,[]
158,Nike Offcourt (MLB New York Yankees), DH7001-001,Mens Shoes & Sneakers,"['6', '7', '8', '9', '10', '11', '12', '13', '14', '15', '16', '17', '18']","Cheer your team to victory in comfort with the Nike Offcourt (MLB New York Yankees) Slide. A cushy synthetic leather strap features your team’s logo, while an innovative foam midsole makes this slide so comfy, you’ll never want to take it off.", Black/Pitch Blue/White/Anthracite,Available,4 Stars,"https://static.nike.com/a/images/t_PDP_1280_v1/f_auto,q_auto:eco/0ff4dfbb-2671-4feb-bac7-8e319905e8a3/offcourt-new-york-yankees-slide-fZtR3g.png",$35,https://www.nike.com/t/offcourt-new-york-yankees-slide-fZtR3g/DH7001-001,[]
159,Nike Air Zoom Tempo NEXT% By You, DC0864-991,Mens Shoes & Sneakers,"['6', '6.5', '7', '7.5', '8', '8.5', '9', '9.5', '10', '10.5', '11', '11.5', '12', '12.5', '13', '14', '15']","Push for your personal best in the Nike Air Zoom Tempo Next% By You. Built like a racer but made for your daily routine, now you can customize it to match your favorite gear. Nike ZoomX foam in the footbed provides energy return, while visible Zoom Air offers responsive cushioning for extra spring with your stride. Nike React technology in the heel is lightweight and durable for a secure feel that won't slow you down. Snug fit. If you prefer a slightly looser fit we recommend ordering a half-size up.", Multi-Color/Multi-Color/Multi-Color,Customize,N/A,"https://static.nike.com/a/images/t_PDP_1280_v1/f_auto,q_auto:eco/db0ccb81-d8ea-416e-b29b-7d6d9eea74ab/custom-nike-air-zoom-tempo-next-by-you.png",$220,https://www.nike.com/u/custom-nike-air-zoom-tempo-next-by-you-10000952/6487598056,N/A
160,Kyrie 7 By You, DA7567-991,Mens Shoes & Sneakers,"['M 3.5 / W 5', 'M 4 / W 5.5', 'M 4.5 / W 6', 'M 5 / W 6.5', 'M 5.5 / W 7', 'M 6 / W 7.5', 'M 6.5 / W 8', 'M 7 / W 8.5', 'M 7.5 / W 9', 'M 8 / W 9.5', 'M 8.5 / W 10', 'M 9 / W 10.5', 'M 9.5 / W 11', 'M 10 / W 11.5', 'M 10.5 / W 12', 'M 11 / W 12.5', 'M 11.5 / W 13', 'M 12 / W 13.5', 'M 12.5 / W 14', 'M 13 / W 14.5', 'M 13.5 / W 15', 'M 14 / W 15.5', 'M 15 / W 16.5', 'M 16 / W 17.5', 'M 17 / W 18.5', 'M 18 / W 19.5']","Kyrie Irving is a creative force on and off the court—you can be too. He needs his shoes to keep up with his playmaking, but also sync with his boundary-pushing style and ethos. The Kyrie 7 By You is tuned for the next generation of energy return, control, speed and self-expression. Leave your mark while optimizing the shoe's fit, court feel and banking ability.", Multi-Color/Multi-Color/Multi-Color,Customize,N/A,"https://static.nike.com/a/images/t_PDP_1280_v1/f_auto,q_auto:eco/dbfdcdaf-d596-4a19-9b66-a1bc1c60e20f/custom-kyrie-7-by-you.png",$150,https://www.nike.com/u/custom-kyrie-7-by-you-10000977/3410607000,N/A
161,Nike SpeedRep, CU3579-101,Mens Shoes & Sneakers,[],"The Nike SpeedRep keeps you ready for high-intensity classes whenever you can squeeze them into your schedule. It combines the cushioning and flexibility of a running shoe with the strength, stability and durability of a traditional training style.", White/Black/White,Member Access,2 Stars,"https://static.nike.com/a/images/t_PDP_1280_v1/f_auto,q_auto:eco/db2e9a60-0555-4943-92e3-a199cf60e364/speedrep-mens-training-shoe-k4JGjh.png",$85,https://www.nike.com/t/speedrep-mens-training-shoe-k4JGjh/CU3579-101,N/A
162,Nike Phantom GT Elite By You, CW0559-993,Mens Shoes & Sneakers,"['M 4 / W 5.5', 'M 4.5 / W 6', 'M 5 / W 6.5', 'M 5.5 / W 7', 'M 6 / W 7.5', 'M 6.5 / W 8', 'M 7 / W 8.5', 'M 7.5 / W 9', 'M 8 / W 9.5', 'M 8.5 / W 10', 'M 9 / W 10.5', 'M 9.5 / W 11', 'M 10 / W 11.5', 'M 10.5 / W 12', 'M 11 / W 12.5', 'M 11.5 / W 13', 'M 12 / W 13.5', 'M 12.5 / W 14', 'M 13 / W 14.5']","Take our most innovative cleat to the next level in the Nike Phantom GT Elite By You. After analyzing thousands of soccer-specific moves, a tacky material was added to the Flyknit construction to give you better touch and control of the ball. Add a Dynamic Fit collar for a feel with even more control or go with a low-cut cleat; then choose the traction that makes sense for your game.", Multi-Color/Multi-Color,Customize,N/A,"https://static.nike.com/a/images/t_PDP_1280_v1/f_auto,q_auto:eco/e8849966-f66c-47a7-b647-3a01ceda0389/custom-nike-phantom-gt-elite-by-you.png",$270,https://www.nike.com/u/custom-nike-phantom-gt-elite-by-you-10000990/8014884521,N/A
163,Nike Zoom Rival M 9, AH1020-007,Mens Shoes & Sneakers,"['M 1 / W 2.5', 'M 1.5 / W 3', 'M 2 / W 3.5', 'M 2.5 / W 4', 'M 3 / W 4.5', 'M 3.5 / W 5', 'M 4 / W 5.5', 'M 4.5 / W 6', 'M 5 / W 6.5', 'M 5.5 / W 7', 'M 6 / W 7.5', 'M 6.5 / W 8', 'M 7 / W 8.5', 'M 7.5 / W 9', 'M 8 / W 9.5', 'M 8.5 / W 10', 'M 9 / W 10.5', 'M 9.5 / W 11', 'M 10 / W 11.5', 'M 10.5 / W 12', 'M 11 / W 12.5', 'M 11.5 / W 13', 'M 12 / W 13.5', 'M 12.5 / W 14', 'M 13 / W 14.5', 'M 14 / W 15.5', 'M 15 / W 16.5']","Designed to be the most versatile track spike for a wide range of events, the Nike Zoom Rival M 9 delivers a cushioned, consistent fit. The arch band offers a secure feel through the midfoot, while the overlay on the upper adds durability in high-wear areas.", Black/Iron Grey/Hyper Crimson/White,Available,4.8 Stars,"https://static.nike.com/a/images/t_PDP_1280_v1/f_auto,q_auto:eco/85b9186d-8467-4e3b-bf48-32a0a84ced70/zoom-rival-m-9-track-spike-mCJ29r.png",$65,https://www.nike.com/t/zoom-rival-m-9-track-spike-mCJ29r/AH1020-007,[]
164,Nike Air Max 270 React SE, CT1265-300,Mens Shoes & Sneakers,[],Refresh your step in the Nike Air Max 270 React SE. It features fresh colors and super breathable no-sew materials on the upper. Nike Air underfoot adds spring to your step while transparent details let your sock game shine., Oracle Aqua/Ghost Green/Washed Coral/Black,Available,4.1 Stars,"https://static.nike.com/a/images/t_PDP_1280_v1/f_auto,q_auto:eco/i1-c910ca52-4124-452c-a749-0b284948b0c5/air-max-270-react-se-mens-shoe-tRMF7N.png",$84.97,https://www.nike.com/t/air-max-270-react-se-mens-shoe-tRMF7N/CT1265-300,[]
165,Nike Spike-Flat, AQ3610-800,Mens Shoes & Sneakers,"['M 4 / W 5.5', 'M 4.5 / W 6', 'M 5 / W 6.5', 'M 5.5 / W 7', 'M 6 / W 7.5', 'M 6.5 / W 8', 'M 7 / W 8.5', 'M 7.5 / W 9', 'M 8 / W 9.5', 'M 8.5 / W 10', 'M 9 / W 10.5', 'M 9.5 / W 11', 'M 10 / W 11.5', 'M 10.5 / W 12', 'M 11 / W 12.5', 'M 11.5 / W 13', 'M 12 / W 13.5', 'M 12.5 / W 14', 'M 13 / W 14.5', 'M 14 / W 15.5', 'M 15 / W 16.5']",Lace up and race to the finish in comfort. The Nike Spike-Flat combines responsive cushioning with a breathable upper for support made for the long haul. Race-ready traction keeps your foot secure as your push ahead of the competition., Bright Mango/Purple Pulse/Blackened Blue,Available,0 Stars,"https://static.nike.com/a/images/t_PDP_1280_v1/f_auto,q_auto:eco/b3c231a2-02d4-4c93-ac19-8c0426d09d77/spike-flat-racing-spikes-TQddcH.png",$90.97,https://www.nike.com/t/spike-flat-racing-spikes-TQddcH/AQ3610-800,N/A
166,Nike Phantom GT Elite By You, CW0559-994,Mens Shoes & Sneakers,"['M 4 / W 5.5', 'M 4.5 / W 6', 'M 5 / W 6.5', 'M 5.5 / W 7', 'M 6 / W 7.5', 'M 6.5 / W 8', 'M 7 / W 8.5', 'M 7.5 / W 9', 'M 8 / W 9.5', 'M 8.5 / W 10', 'M 9 / W 10.5', 'M 9.5 / W 11', 'M 10 / W 11.5', 'M 10.5 / W 12', 'M 11 / W 12.5', 'M 11.5 / W 13', 'M 12 / W 13.5', 'M 12.5 / W 14', 'M 13 / W 14.5']","Take our most innovative cleat to the next level in the Nike Phantom GT Elite By You. After analyzing thousands of soccer-specific moves, a tacky material was added to the Flyknit construction to give you better touch and control of the ball. Add a Dynamic Fit collar for a feel with even more control or go with a low-cut cleat; then choose the traction that makes sense for your game.", Multi-Color/Multi-Color,Customize,N/A,"https://static.nike.com/a/images/t_PDP_1280_v1/f_auto,q_auto:eco/ab702ec1-738e-4927-a247-46ba28891526/custom-nike-phantom-gt-elite-by-you.png",$270,https://www.nike.com/u/custom-nike-phantom-gt-elite-by-you-10000982/9663720862,N/A
167,Nike SB Zoom Blazer Mid Premium, DA1839-300,Mens Shoes & Sneakers,"['M 6 / W 7.5', 'M 6.5 / W 8', 'M 7 / W 8.5', 'M 7.5 / W 9', 'M 8 / W 9.5', 'M 8.5 / W 10', 'M 9 / W 10.5', 'M 9.5 / W 11', 'M 10 / W 11.5', 'M 10.5 / W 12', 'M 11 / W 12.5', 'M 11.5 / W 13', 'M 12 / W 13.5', 'M 13 / W 14.5', 'M 14 / W 15.5', 'M 15 / W 16.5']","Styled with slightly distressed suede, the Nike SB Zoom Blazer Mid Premium takes its cues from the well-worn pair of sneakers you've had for years. This pair may look like that faded favorite, but it comes with a responsive Zoom Air unit and a new, grippy outsole that's built to skate.", Light Dew/Green Glow/Arctic Punch/Light Zitron,Available,4 Stars,"https://static.nike.com/a/images/t_PDP_1280_v1/f_auto,q_auto:eco/27a121e9-08a6-4c1f-8e4b-0927a9c2571e/sb-zoom-blazer-mid-premium-skate-shoe-bcP1Nd.png",$110,https://www.nike.com/t/sb-zoom-blazer-mid-premium-skate-shoe-bcP1Nd/DA1839-300,[]
168,Nike Tanjun, 812654-101,Mens Shoes & Sneakers,"['6', '6.5', '7', '7.5', '8', '8.5', '9', '9.5', '10', '10.5', '11', '11.5', '12', '12.5', '13', '14', '15']","""Tanjun"" means ""simplicity"" in Japanese, and the Nike Tanjun Shoe is simplicity at its best. It has a modern look and design is convenient and comfortable, while a sleek upper gives a clean look and fit.", White/Black,Available,4.6 Stars,"https://static.nike.com/a/images/t_PDP_1280_v1/f_auto,q_auto:eco/ycxzqylij0pahuk09gd1/tanjun-mens-shoe-w8ToA8jr.png",$65,https://www.nike.com/t/tanjun-mens-shoe-w8ToA8jr/812654-101,[]
